<?xml version="1.0"?>

<!DOCTYPE book SYSTEM "bookNormalized.dtd">

<book>
<bookTitle>Compiler Construction</bookTitle>

<chapter id="scanParseCH">
<heading>Scanning and Parsing</heading>

<par><authorsRef refid="dragonBook"/>
in <emph>their <emph>highly popular</emph>
textbook on compiler construction</emph> <ref refid="dragonBook"/>
introduce
<list><li>scanning and</li>
      <li>parsing</li></list>
as the first two phases in compiler construction.<fn>The other
three phases are <list><li>semantic analysis,</li><li>code
generation, and</li><li>code optimization.</li></list></fn></par>

<par><authorsRef refid="loomBook"/> <ref refid="loomBook"/>
provide the theoretical foundation for scanning and parsing.</par>

<par>In <ref refid="laterPhasesCh"/>
we examine the later phases.</par>
</chapter>

<chapter id="laterPhasesCh">
<heading>The Later Phases</heading>
</chapter>

<references>
<heading>References</heading>

<bookRef id="dragonBook">
<author><chrName>A.V.</chrName><famName>Aho</famName></author>
<author><chrName>R.</chrName><famName>Sethi</famName></author>
<author><chrName>J.D.</chrName><famName>Ullman</famName></author>
<title>Compilers: Principles, Techniques, and Tools</title>
<publ>Addison-Wesley</publ><year>1986</year>
</bookRef>

<bookRef id="loomBook">
<author><chrName>J.E.</chrName><famName>Hopcroft</famName></author>
<author><chrName>J.D.</chrName><famName>Ullman</famName></author>
<title>Introduction to Automata Theory, Languages and Computation</title>
<publ>Addison-Wesley</publ><year>1979</year>
</bookRef>
</references>
</book>


